{
  "schemaVersion": 1,
  "source": "@smogon/calc",
  "version": "0.10.0",
  "generation": 9,
  "note": "Multiplier codes are the effectiveness x2 as integers (0=immune, 1=not very effective, 2=neutral, 4=super effective). ADR-0013",
  "excludedTypes": [
    "???",
    "stellar"
  ],
  "types": [
    "bug",
    "dark",
    "dragon",
    "electric",
    "fairy",
    "fighting",
    "fire",
    "flying",
    "ghost",
    "grass",
    "ground",
    "ice",
    "normal",
    "poison",
    "psychic",
    "rock",
    "steel",
    "water"
  ],
  "effectiveness": {
    "bug": {
      "bug": 2,
      "dark": 4,
      "dragon": 2,
      "electric": 2,
      "fairy": 1,
      "fighting": 1,
      "fire": 1,
      "flying": 1,
      "ghost": 1,
      "grass": 4,
      "ground": 2,
      "ice": 2,
      "normal": 2,
      "poison": 1,
      "psychic": 4,
      "rock": 2,
      "steel": 1,
      "water": 2
    },
    "dark": {
      "bug": 2,
      "dark": 1,
      "dragon": 2,
      "electric": 2,
      "fairy": 1,
      "fighting": 1,
      "fire": 2,
      "flying": 2,
      "ghost": 4,
      "grass": 2,
      "ground": 2,
      "ice": 2,
      "normal": 2,
      "poison": 2,
      "psychic": 4,
      "rock": 2,
      "steel": 2,
      "water": 2
    },
    "dragon": {
      "bug": 2,
      "dark": 2,
      "dragon": 4,
      "electric": 2,
      "fairy": 0,
      "fighting": 2,
      "fire": 2,
      "flying": 2,
      "ghost": 2,
      "grass": 2,
      "ground": 2,
      "ice": 2,
      "normal": 2,
      "poison": 2,
      "psychic": 2,
      "rock": 2,
      "steel": 1,
      "water": 2
    },
    "electric": {
      "bug": 2,
      "dark": 2,
      "dragon": 1,
      "electric": 1,
      "fairy": 2,
      "fighting": 2,
      "fire": 2,
      "flying": 4,
      "ghost": 2,
      "grass": 1,
      "ground": 0,
      "ice": 2,
      "normal": 2,
      "poison": 2,
      "psychic": 2,
      "rock": 2,
      "steel": 2,
      "water": 4
    },
    "fairy": {
      "bug": 2,
      "dark": 4,
      "dragon": 4,
      "electric": 2,
      "fairy": 2,
      "fighting": 4,
      "fire": 1,
      "flying": 2,
      "ghost": 2,
      "grass": 2,
      "ground": 2,
      "ice": 2,
      "normal": 2,
      "poison": 1,
      "psychic": 2,
      "rock": 2,
      "steel": 1,
      "water": 2
    },
    "fighting": {
      "bug": 1,
      "dark": 4,
      "dragon": 2,
      "electric": 2,
      "fairy": 1,
      "fighting": 2,
      "fire": 2,
      "flying": 1,
      "ghost": 0,
      "grass": 2,
      "ground": 2,
      "ice": 4,
      "normal": 4,
      "poison": 1,
      "psychic": 1,
      "rock": 4,
      "steel": 4,
      "water": 2
    },
    "fire": {
      "bug": 4,
      "dark": 2,
      "dragon": 1,
      "electric": 2,
      "fairy": 2,
      "fighting": 2,
      "fire": 1,
      "flying": 2,
      "ghost": 2,
      "grass": 4,
      "ground": 2,
      "ice": 4,
      "normal": 2,
      "poison": 2,
      "psychic": 2,
      "rock": 1,
      "steel": 4,
      "water": 1
    },
    "flying": {
      "bug": 4,
      "dark": 2,
      "dragon": 2,
      "electric": 1,
      "fairy": 2,
      "fighting": 4,
      "fire": 2,
      "flying": 2,
      "ghost": 2,
      "grass": 4,
      "ground": 2,
      "ice": 2,
      "normal": 2,
      "poison": 2,
      "psychic": 2,
      "rock": 1,
      "steel": 1,
      "water": 2
    },
    "ghost": {
      "bug": 2,
      "dark": 1,
      "dragon": 2,
      "electric": 2,
      "fairy": 2,
      "fighting": 2,
      "fire": 2,
      "flying": 2,
      "ghost": 4,
      "grass": 2,
      "ground": 2,
      "ice": 2,
      "normal": 0,
      "poison": 2,
      "psychic": 4,
      "rock": 2,
      "steel": 2,
      "water": 2
    },
    "grass": {
      "bug": 1,
      "dark": 2,
      "dragon": 1,
      "electric": 2,
      "fairy": 2,
      "fighting": 2,
      "fire": 1,
      "flying": 1,
      "ghost": 2,
      "grass": 1,
      "ground": 4,
      "ice": 2,
      "normal": 2,
      "poison": 1,
      "psychic": 2,
      "rock": 4,
      "steel": 1,
      "water": 4
    },
    "ground": {
      "bug": 1,
      "dark": 2,
      "dragon": 2,
      "electric": 4,
      "fairy": 2,
      "fighting": 2,
      "fire": 4,
      "flying": 0,
      "ghost": 2,
      "grass": 1,
      "ground": 2,
      "ice": 2,
      "normal": 2,
      "poison": 4,
      "psychic": 2,
      "rock": 4,
      "steel": 4,
      "water": 2
    },
    "ice": {
      "bug": 2,
      "dark": 2,
      "dragon": 4,
      "electric": 2,
      "fairy": 2,
      "fighting": 2,
      "fire": 1,
      "flying": 4,
      "ghost": 2,
      "grass": 4,
      "ground": 4,
      "ice": 1,
      "normal": 2,
      "poison": 2,
      "psychic": 2,
      "rock": 2,
      "steel": 1,
      "water": 1
    },
    "normal": {
      "bug": 2,
      "dark": 2,
      "dragon": 2,
      "electric": 2,
      "fairy": 2,
      "fighting": 2,
      "fire": 2,
      "flying": 2,
      "ghost": 0,
      "grass": 2,
      "ground": 2,
      "ice": 2,
      "normal": 2,
      "poison": 2,
      "psychic": 2,
      "rock": 1,
      "steel": 1,
      "water": 2
    },
    "poison": {
      "bug": 2,
      "dark": 2,
      "dragon": 2,
      "electric": 2,
      "fairy": 4,
      "fighting": 2,
      "fire": 2,
      "flying": 2,
      "ghost": 1,
      "grass": 4,
      "ground": 1,
      "ice": 2,
      "normal": 2,
      "poison": 1,
      "psychic": 2,
      "rock": 1,
      "steel": 0,
      "water": 2
    },
    "psychic": {
      "bug": 2,
      "dark": 0,
      "dragon": 2,
      "electric": 2,
      "fairy": 2,
      "fighting": 4,
      "fire": 2,
      "flying": 2,
      "ghost": 2,
      "grass": 2,
      "ground": 2,
      "ice": 2,
      "normal": 2,
      "poison": 4,
      "psychic": 1,
      "rock": 2,
      "steel": 1,
      "water": 2
    },
    "rock": {
      "bug": 4,
      "dark": 2,
      "dragon": 2,
      "electric": 2,
      "fairy": 2,
      "fighting": 1,
      "fire": 4,
      "flying": 4,
      "ghost": 2,
      "grass": 2,
      "ground": 1,
      "ice": 4,
      "normal": 2,
      "poison": 2,
      "psychic": 2,
      "rock": 2,
      "steel": 1,
      "water": 2
    },
    "steel": {
      "bug": 2,
      "dark": 2,
      "dragon": 2,
      "electric": 1,
      "fairy": 4,
      "fighting": 2,
      "fire": 1,
      "flying": 2,
      "ghost": 2,
      "grass": 2,
      "ground": 2,
      "ice": 4,
      "normal": 2,
      "poison": 2,
      "psychic": 2,
      "rock": 4,
      "steel": 1,
      "water": 1
    },
    "water": {
      "bug": 2,
      "dark": 2,
      "dragon": 1,
      "electric": 2,
      "fairy": 2,
      "fighting": 2,
      "fire": 4,
      "flying": 2,
      "ghost": 2,
      "grass": 1,
      "ground": 4,
      "ice": 2,
      "normal": 2,
      "poison": 2,
      "psychic": 2,
      "rock": 4,
      "steel": 2,
      "water": 1
    }
  }
}
